{
  "host": "sample",
  "schemaVersion": 1,
  "updatedAt": "2026-09-24T20:00:00Z",
  "days": [
    {
      "date": "2026-09-23",
      "cost": 41.28,
      "tokens": 18420000,
      "cacheRead": 902000000,
      "byModel": [
        { "model": "claude-opus-5", "cost": 30.14, "tokens": 12800000 },
        { "model": "gpt-5.6-sol", "cost": 11.14, "tokens": 5620000 }
      ]
    },
    {
      "date": "2026-09-24",
      "cost": 58.03,
      "tokens": 22100000,
      "cacheRead": 1180000000,
      "byModel": [
        { "model": "claude-opus-5-5", "cost": 44.20, "tokens": 15000000 },
        { "model": "gpt-6-astra", "cost": 13.83, "tokens": 7100000 }
      ]
    }
  ]
}
